{
  "$schema": "https://json-schema.org/draft/2020-12/schema",
  "title": "Tutivar Pair-Specific Course Manifest",
  "type": "object",
  "required": ["id", "schemaVersion", "revision", "status", "pairId", "level", "blueprintRef", "chapters", "lessonOrder", "workshops", "finalAssessmentRef"],
  "additionalProperties": false,
  "properties": {
    "id": { "type": "string", "minLength": 3 },
    "schemaVersion": { "type": "string", "pattern": "^[0-9]+\\.[0-9]+\\.[0-9]+$" },
    "revision": { "type": "integer", "minimum": 1 },
    "status": { "enum": ["draft", "validated", "approved", "published"] },
    "pairId": { "type": "string", "pattern": "^[a-z]{2,3}-[a-z]{2,3}$" },
    "level": { "enum": ["A0", "A1", "A2", "B1", "B2", "C1", "C2"] },
    "blueprintRef": { "type": "string", "minLength": 3 },
    "chapters": { "type": "array", "items": { "type": "object", "additionalProperties": false, "required": ["id", "blueprintChapterId", "lessonIds"], "properties": {
      "id": { "type": "string", "minLength": 1 },
      "blueprintChapterId": { "type": "string", "minLength": 1 },
      "lessonIds": { "type": "array", "uniqueItems": true, "items": { "type": "string" } }
    } } },
    "lessonOrder": { "type": "array", "uniqueItems": true, "items": { "type": "string", "minLength": 3 } },
    "workshops": { "type": "array", "items": { "type": "object", "additionalProperties": false, "required": ["chapterId", "lessonId"], "properties": { "chapterId": { "type": "string" }, "lessonId": { "type": "string" } } } },
    "finalAssessmentRef": { "type": ["string", "null"] }
  }
}
